decision,evidence,design_consequence,validation
Treat tire capability and load sensitivity as architecture-level requirements.,"EnvelopeSens ranks tire mu first for combined track index, GGV volume, acceleration, braking, and YMD yaw moment authority.","Tire selection, tire data quality, pressure/camber window, and load-transfer management must be protected before setup micro-optimization.","Correlate tire operating range with ISO 4138 slow-ramp data, tire temperatures, pressure rise, and driver saturation comments."
Keep the vehicle low-CG and mass-disciplined.,"CG height and sprung mass repeatedly move GGV volume, braking, roll gradient, and refined response-surface lateral/roll outcomes.","Packaging, ballast, driver position, and subsystem mass are vehicle-dynamics decisions, not only packaging decisions.","Weigh the car, measure CG if possible, and update vehicle.yml before correlation runs."
Use downforce and aero balance as primary performance and balance levers.,"Aero load/downforce affects track combined index, GGV volume, reference cornering, StandardSim lateral limit, and refined steady-state response.","Aero maps, ride-height control, and aero balance need ownership in the design loop before final spring/bar tuning.","Track-test ride heights, rake, speed sensitivity, and balance change with aero trim."
"Use roll stiffness distribution as a platform/balance tool, not a raw-grip magic knob.",FourPost reports 52.1% front LLTD; EnvelopeSens and StandardSens both identify rear bar / roll-platform variables as balance and cornering levers.,"Spring/bar choices should target roll control, platform stability, and predictable balance while preserving tire use.","Run setup sweeps for roll gradient, understeer gradient, tire temperatures, and driver confidence."
"Keep static alignment near a clean baseline, then trim with small targeted sweeps.",StandardSens selects camber as a high-authority lateral-limit and balance input; broad sweeps can overwhelm interpretation.,"Use broad simulation sweeps to identify authority, then converge with narrow physical setup sweeps around realistic settings.",Run ISO 4138-style slow-ramp A/B tests around small camber/toe windows.
"Use refined response surfaces to justify tradeoffs, not to declare a single universal optimum.","The refined DOE quantifies interacting pairs selected from tornado effects, including camber/aero for lateral limit, rear camber/rear bar for balance, and CG height/mass for roll.","Present design regions and constraints, not cherry-picked single variants.","Overlay build limits, tire-temperature constraints, driver feedback, and endurance robustness on the response surfaces."
